{
  "schemaVersion": 1,
  "kind": "dev.dory.virtualization-evidence",
  "subsystem": "cpu",
  "issueLabel": "subsystem:cpu",
  "planItems": [
    "P02-11",
    "P02-12",
    "P02-15"
  ],
  "sourceCommit": "07fc927e531850ee89e7503e44f2ced8ca585ec2",
  "cells": [
    "linux-x86_64-translated"
  ],
  "host": {
    "architecture": "arm64",
    "version": "27.0",
    "build": "26A5425a",
    "classification": "experimental",
    "xcodeBuild": "17F109",
    "sdk": "26.5"
  },
  "status": "baseline-recorded",
  "scope": "Source47 floating-point reset preservation and protected IRET width/privilege/fault regression gate. No new checkpoint or guest qualification.",
  "releaseQualified": false,
  "artifacts": [
    {
      "path": "docs/virtualization/evidence/p02-correctness-2026-09-04/review-through-run-47.json",
      "sha256": "5bf34a698aacae07eed9d6c9d304103d76c4112fe6a3cc0a35e12ec0d5638dcb"
    }
  ],
  "limitations": [
    "No checkpoint is newly closed by this source gate. P02 remains incomplete: physical reference, full CPU/FPU/mode/paging/fault qualification and device-backed stability stress remain open.",
    "One disabled physical-reference method and one optional XCTest boot-fixture skip are preserved and excluded from pass counts. Overlapping runs are not summed.",
    "The5 new floating-point-reset methods and8 new IRET methods are bounded authored regressions, not physical-hardware reference executions or complete architecture coverage. The existing10-method paging-feature suite also passes after its precise-fault expectation update.",
    "This incremental source47 test gate adds no optimized runner or new guest execution. Systemd2 remains bound to source45 and its separate retained receipt. Active IO1 is excluded.",
    "Experimental host with concurrent work; timings are engineering observations, not P14 qualification."
  ]
}
